{
  "$schema": "https://json-schema.org/draft/2020-12/schema",
  "$id": "https://gtmstack.local/schemas/animation-meta.schema.json",
  "title": "GTMStack Animation Content Metadata",
  "type": "object",
  "additionalProperties": false,
  "required": [
    "id",
    "title",
    "description",
    "tags",
    "category",
    "published",
    "featured",
    "createdAt",
    "updatedAt",
    "thumbnail",
    "componentPath"
  ],
  "properties": {
    "id": {
      "type": "string"
      ,"pattern": "^[a-z0-9]+(?:-[a-z0-9]+)*$"
    },
    "title": {
      "type": "string",
      "minLength": 1
    },
    "description": {
      "type": "string",
      "minLength": 1
    },
    "tags": {
      "type": "array",
      "items": {
        "type": "string",
        "minLength": 1
      },
      "uniqueItems": true
    },
    "category": {
      "type": "string",
      "enum": [
        "hero",
        "background",
        "button",
        "text",
        "card",
        "loader",
        "nav",
        "other"
      ]
    },
    "published": {
      "type": "boolean"
    },
    "featured": {
      "type": "boolean"
    },
    "createdAt": {
      "type": "string",
      "pattern": "^\\d{4}-\\d{2}-\\d{2}T\\d{2}:\\d{2}:\\d{2}(?:\\.\\d{3})?(?:Z|[+-]\\d{2}:\\d{2})$"
    },
    "updatedAt": {
      "type": "string",
      "pattern": "^\\d{4}-\\d{2}-\\d{2}T\\d{2}:\\d{2}:\\d{2}(?:\\.\\d{3})?(?:Z|[+-]\\d{2}:\\d{2})$"
    },
    "thumbnail": {
      "type": "string",
      "pattern": "^animations\\/.+\\.(png|jpg|jpeg|webp)$"
    },
    "componentPath": {
      "type": "string",
      "pattern": "^animations\\/.+\\.(tsx|html)$"
    }
  }
}