{
  "id": "marketing-revenue-analytics-v2",
  "title": "Marketing Revenue Analytics",
  "description": "Marketing revenue analytics tile showing attribution impact, channel efficiency, and revenue trend direction.",
  "tags": [
    "Revenue Analytics",
    "Marketing Attribution",
    "Channel Performance",
    "Growth Trends"
  ],
  "category": "card",
  "published": true,
  "featured": false,
  "createdAt": "2026-03-23T20:00:00.000Z",
  "updatedAt": "2026-03-23T20:00:00.000Z",
  "thumbnail": "animations/misc/marketing-revenue-analytics-v2/thumbnail.png",
  "componentPath": "animations/misc/marketing-revenue-analytics-v2/component.tsx"
}