{
  "id": "marketingflow-ai-workflow-v2",
  "title": "MarketingFlow AI Workflow",
  "description": "Workflow visualization for AI-assisted content operations, from planning through optimization and performance feedback.",
  "tags": [
    "AI Workflow",
    "Content Operations",
    "Marketing Automation",
    "Performance Analytics"
  ],
  "category": "card",
  "published": true,
  "featured": false,
  "createdAt": "2026-03-23T20:00:00.000Z",
  "updatedAt": "2026-03-23T20:00:00.000Z",
  "thumbnail": "animations/dashboard-tiles/marketingflow-ai-workflow-v2/preview.png",
  "componentPath": "animations/dashboard-tiles/marketingflow-ai-workflow-v2/Content-Marketing.tsx"
}
