{
  "id": "live-email-automation-ecosystem-v3",
  "title": "Live Email Automation Ecosystem",
  "description": "Live Email Automation Ecosystem — GTMStack animation for operations use cases.",
  "tags": [
    "operations",
    "live",
    "email",
    "automation",
    "ecosystem"
  ],
  "category": "card",
  "published": true,
  "featured": false,
  "createdAt": "2026-03-23T20:00:00.000Z",
  "updatedAt": "2026-03-23T20:00:00.000Z",
  "thumbnail": "animations/operations/live-email-automation-ecosystem-v3/preview.png",
  "componentPath": "animations/operations/live-email-automation-ecosystem-v3/Live-Email-Automation.tsx"
}
