{
  "id": "abm-radar-analysis-v2",
  "title": "ABM Radar Analysis",
  "description": "Radar-style ABM analysis tile visualizing account engagement intensity, pipeline signals, and campaign momentum.",
  "tags": [
    "ABM Analytics",
    "Radar Visualization",
    "Account Engagement",
    "Pipeline Insights"
  ],
  "category": "card",
  "published": true,
  "featured": true,
  "createdAt": "2026-03-23T20:00:00.000Z",
  "updatedAt": "2026-03-23T20:00:00.000Z",
  "thumbnail": "animations/abm-radar-analysis-v2/thumbnail.png",
  "componentPath": "animations/abm-radar-analysis-v2/component.tsx"
}