{
  "id": "b2b-consulting-portfolio-gtmstack-pro",
  "title": "B2b Consulting Portfolio Gtmstack Pro",
  "description": "B2b Consulting Portfolio Gtmstack Pro — GTMStack animation for industries use cases.",
  "tags": [
    "industries",
    "b2b",
    "consulting",
    "portfolio",
    "gtmstack",
    "pro"
  ],
  "category": "other",
  "published": true,
  "featured": false,
  "createdAt": "2026-03-23T20:00:00.000Z",
  "updatedAt": "2026-03-23T20:00:00.000Z",
  "thumbnail": "animations/industries/b2b-consulting-portfolio-gtmstack-pro/preview.png",
  "componentPath": "animations/industries/b2b-consulting-portfolio-gtmstack-pro/constants.tsx"
}
