{
  "id": "agency-performance-console-v2",
  "title": "Agency Performance Console",
  "description": "Agency Performance Console — GTMStack animation for events media use cases.",
  "tags": [
    "events-media",
    "agency",
    "performance",
    "console"
  ],
  "category": "card",
  "published": true,
  "featured": false,
  "createdAt": "2026-03-23T20:00:00.000Z",
  "updatedAt": "2026-03-23T20:00:00.000Z",
  "thumbnail": "animations/events-media/agency-performance-console-v2/preview.png",
  "componentPath": "animations/events-media/agency-performance-console-v2/components/PerformanceConsole.tsx"
}
