{
  "id": "kpi-spotlight-mosaic-v2",
  "title": "Kpi Spotlight Mosaic",
  "description": "Kpi Spotlight Mosaic — GTMStack animation for digital demand use cases.",
  "tags": [
    "digital-demand",
    "kpi",
    "spotlight",
    "mosaic"
  ],
  "category": "hero",
  "published": true,
  "featured": false,
  "createdAt": "2026-03-23T20:00:00.000Z",
  "updatedAt": "2026-03-23T20:00:00.000Z",
  "thumbnail": "animations/digital-demand/kpi-spotlight-mosaic-v2/preview.png",
  "componentPath": "animations/digital-demand/kpi-spotlight-mosaic-v2/KpiSpotlightMosaic.tsx"
}
