{
  "id": "content-marketing-kpi-dashboard-v2",
  "title": "Content Marketing Kpi Dashboard",
  "description": "Content Marketing Kpi Dashboard — GTMStack animation for digital demand use cases.",
  "tags": [
    "digital-demand",
    "content",
    "marketing",
    "kpi",
    "dashboard"
  ],
  "category": "hero",
  "published": true,
  "featured": false,
  "createdAt": "2026-03-23T20:00:00.000Z",
  "updatedAt": "2026-03-23T20:00:00.000Z",
  "thumbnail": "animations/digital-demand/content-marketing-kpi-dashboard-v2/preview.png",
  "componentPath": "animations/digital-demand/content-marketing-kpi-dashboard-v2/components/ContentGrowthDashboard.tsx"
}
